### ISSUE TITLE
SR-SIM packet capture on veth interface works on Ingress only

### ISSUE THREAD

**Issue by sacckth** [srl-labs/containerlab#2741]
When deploying a SR-SIM with clab and using tcpdump or other packet capture tool to capture packets on an interface, the trace will only show ingress: 

So, using as example topology  from  https://raw.githubusercontent.com/srl-labs/containerlab/refs/heads/main/lab-examples/sr-sim/lab-integrated.clab.yaml which is just two SR-SIMs connected back-to-back we can observe the following

Topology clab: 
```
  7750 SR-1                                7750 SR-1
+-----------+                            +-----------+
|  1/1/c1/1 | .10                    .11 | 1/1/c1/1  |
|           +-e1-1-c1-1---------e1-1-c1-1+           |
|           |        10.0.0.0/24         |           |
|  srsim10  |                            |  srsim11  |
|           |        10.0.1.0/24         |           |
|  1/1/c1/2 +-e1-1-c1-2--------e1-1-c1-2-+ 1/1/c1/2  |
|           | .10                    .11 |           |
+-+---------+                            +-+---------+
  | .10                                    | .11
  |                                        |
  +---------------------+------------------+ srsim_mgmt 10.77.140.0/24
                        |
                        | .1
                     +--+---+
                     | host |
                     +------+

```
Test:
```
A:admin@sr-sim10# show  router interface

===============================================================================
Interface Table (Router: Base)
===============================================================================
Interface-Name                   Adm       Opr(v4/v6)  Mode    Port/SapId
   IP-Address                                                  PfxState
-------------------------------------------------------------------------------
ptp1                             Up        Up/Down     Network 1/1/c1/1
   10.0.0.10/24                                                n/a
ptp2                             Up        Up/Down     Network 1/1/c1/2
   10.0.1.10/24                                                n/a
system                           Up        Up/Down     Network system
   100.0.0.10/32                                               n/a
-------------------------------------------------------------------------------
Interfaces : 3
===============================================================================

[/]
A:admin@sr-sim10# ping 10.0.0.11
PING 10.0.0.11 56 data bytes
64 bytes from 10.0.0.11: icmp_seq=1 ttl=64 time=1.18ms.
64 bytes from 10.0.0.11: icmp_seq=2 ttl=64 time=1.78ms.
64 bytes from 10.0.0.11: icmp_seq=3 ttl=64 time=2.08ms.
64 bytes from 10.0.0.11: icmp_seq=4 ttl=64 time=2.16ms.
64 bytes from 10.0.0.11: icmp_seq=5 ttl=64 time=2.04ms.

---- 10.0.0.11 PING Statistics ----
5 packets transmitted, 5 packets received, 0.00% packet loss
round-trip min = 1.18ms, avg = 1.85ms, max = 2.16ms, stddev = 0.355ms

[/]
```
SHELL output:
```bash
$ sudo ip netns exec clab-sros-sr-sim10 tcpdump -nni e1-1-c1-1
tcpdump: verbose output suppressed, use -v[v]... for full protocol decode
listening on e1-1-c1-1, link-type EN10MB (Ethernet), snapshot length 262144 bytes



^C16:12:50.156964 IS-IS, L1 CSNP, src-id 1000.0000.0011.00, length 99
16:12:50.461767 IS-IS, L2 CSNP, src-id 1000.0000.0011.00, length 99
16:12:51.755659 IS-IS, L2 Lan IIH, src-id 1000.0000.0011, lan-id 1000.0000.0011.01, prio 64, length 50
16:12:51.755683 IS-IS, L1 Lan IIH, src-id 1000.0000.0011, lan-id 1000.0000.0011.01, prio 64, length 50
16:12:52.150350 IP 10.0.0.11 > 10.0.0.10: ICMP echo reply, id 250, seq 32769, length 64
16:12:53.123583 IP 10.0.0.11 > 10.0.0.10: ICMP echo reply, id 250, seq 32770, length 64
16:12:54.117501 IP 10.0.0.11 > 10.0.0.10: ICMP echo reply, id 250, seq 32771, length 64
16:12:54.759641 IS-IS, L1 Lan IIH, src-id 1000.0000.0011, lan-id 1000.0000.0011.01, prio 64, length 50
16:12:54.759666 IS-IS, L2 Lan IIH, src-id 1000.0000.0011, lan-id 1000.0000.0011.01, prio 64, length 50
16:12:55.120889 IP 10.0.0.11 > 10.0.0.10: ICMP echo reply, id 250, seq 32772, length 64
16:12:56.124901 IP 10.0.0.11 > 10.0.0.10: ICMP echo reply, id 250, seq 32773, length 64

11 packets captured
11 packets received by filter
0 packets dropped by kernel
```

Topology docker, note that in this case the difference will be that the p2p links are linux bridges instead of veth pairs: 
```
  7750 SR-1                                7750 SR-1
+-----------+                            +-----------+
|  1/1/c1/1 | .10                    .11 | 1/1/c1/1  |
|           +-----srsim10_srsim11_1------+           |
|           |        10.0.0.0/24         |           |
|  srsim10  |                            |  srsim11  |
|           |        10.0.1.0/24         |           |
|  1/1/c1/2 +-----srsim10_srsim11_2------+ 1/1/c1/2  |
|           | .10                    .11 |           |
+-+---------+                            +-+---------+
  | .10                                    | .11
  |                                        |
  +---------------------+------------------+ srsim_mgmt 10.77.140.0/24
                        |
                        | .1
                     +--+---+
                     | host |
                     +------+

```

Docker deployment:
```bash
$  docker network create --driver bridge --subnet 10.77.140.0/24 --gateway 10.77.140.1 --opt com.docker.network.driver.mtu=9000 --opt com.docker.network.bridge.name=srsim_mgmt srsim_mgmt
$  sudo ethtool -K srsim_mgmt tx-checksum-ip-generic off
$  docker network create srsim10_srsim11_1
$  docker network create srsim10_srsim11_2
$ docker run --privileged --rm --name srsim10 -d    --network srsim_mgmt --ip 10.77.140.10  --network=name=srsim10_srsim11_1,driver-opt=com.docker.network.endpoint.ifname=e1-1-c1-1   --network=name=srsim10_srsim11_2,driver-opt=com.docker.network.endpoint.ifname=e1-1-c1-2   -v /opt/nokia/sros/license.txt:/nokia/license/license.txt   -v srsim10.partial.cfg:/nokia/config/config.cfg    registry.srlinux.dev/pub/nokia_srsim:25.7.R1
$ docker run --privileged --rm --name srsim11 -d  --network srsim_mgmt --ip 10.77.140.11   --network=name=srsim10_srsim11_1,driver-opt=com.docker.network.endpoint.ifname=e1-1-c1-1    --network=name=srsim10_srsim11_2,driver-opt=com.docker.network.endpoint.ifname=e1-1-c1-2    -v /opt/nokia/sros/license.txt:/nokia/license/license.txt    -v ./srsim11.cfg:/nokia/config/config.cfg    registry.srlinux.dev/pub/nokia_srsim:25.7.R1
```

TCPDUMP for docker deployment:
```bash
$ docker network ls
NETWORK ID     NAME                DRIVER    SCOPE
6cadfba334c5   bridge              bridge    local
c69c602590e6   clab                bridge    local
ab4c19c09dd7   host                host      local
d0f320de6fd0   none                null      local
01ea61c61c25   srsim10_srsim11_1   bridge    local
81a460edce04   srsim10_srsim11_2   bridge    local
2696552cce33   srsim_mgmt          bridge    local

$ sudo tcpdump -nni br-01ea61c61c25
tcpdump: verbose output suppressed, use -v[v]... for full protocol decode
listening on br-01ea61c61c25, link-type EN10MB (Ethernet), snapshot length 262144 bytes
16:22:16.051179 IS-IS, L2 Lan IIH, src-id 1000.0000.0010, lan-id 1000.0000.0010.01, prio 64, length 50
16:22:16.051222 IS-IS, L1 Lan IIH, src-id 1000.0000.0010, lan-id 1000.0000.0010.01, prio 64, length 50
16:22:16.078025 IP 10.0.0.10 > 10.0.0.11: ICMP echo request, id 250, seq 16405, length 64
16:22:16.078080 IP 10.0.0.10 > 10.0.0.11: ICMP echo request, id 250, seq 16405, length 64
16:22:16.079193 IP 10.0.0.11 > 10.0.0.10: ICMP echo reply, id 250, seq 16405, length 64
16:22:16.079239 IP 10.0.0.11 > 10.0.0.10: ICMP echo reply, id 250, seq 16405, length 64
16:22:16.080960 IP 10.77.140.1.46436 > 10.77.140.10.22: Flags [.], ack 1894606734, win 605, options [nop,nop,TS val 3278023542 ecr 3524098541], length 0
^C
7 packets captured
7 packets received by filter
0 packets dropped by kernel
```

**Comment by sacckth** [comment]
Confirmed with a manual test mimicking clab processing under the hood that this is coming from the SR-SIM itself. So not a clab issue:
```bash
docker network create --driver bridge --subnet 10.77.140.0/24 --gateway 10.77.140.1 --opt com.docker.network.driver.mtu=9000 --opt com.docker.network.bridge.name=srsim_mgmt srsim_mgmt
sudo ethtool -K srsim_mgmt tx-checksum-ip-generic off

docker run --privileged --rm --name srsim10 -d  --network srsim_mgmt --ip 10.77.140.10    -v /opt/nokia/sros/license.txt:/nokia/license/license.txt   -v ~/wk/containerlab/lab-examples/sr-sim/configs/srsim10.partial.cfg:/home/sros/flash1/config.cfg  registry.srlinux.dev/pub/nokia_srsim:25.7.R1
docker run --privileged --rm --name srsim11 -d  --network srsim_mgmt --ip 10.77.140.11      -v /opt/nokia/sros/license.txt:/nokia/license/license.txt   -v ~/wk/containerlab/lab-examples/sr-sim/configs/srsim11.partial.cfg:/home/sros/flash1/config.cfg  registry.srlinux.dev/pub/nokia_srsim:25.7.R1
pid=$(docker inspect -f '{{.State.Pid}}' srsim10)
mkdir -p /var/run/netns/
sudo ln -sfT /proc/$pid/ns/net /var/run/netns/srsim10
pid=$(docker inspect -f '{{.State.Pid}}' srsim11)
mkdir -p /var/run/netns/
sudo ln -sfT /proc/$pid/ns/net /var/run/netns/srsim11

sudo ip link add veth0 type veth peer name veth1
sudo ip link set veth0 netns srsim10
sudo ip link set veth1 netns srsim11
sudo ip netns exec srsim10 ip link set veth0 name e1-1-c1-1
sudo ip netns exec srsim11 ip link set veth1 name e1-1-c1-1
sudo ip netns exec srsim10 ip link set e1-1-c1-1 mtu 9000
sudo ip netns exec srsim10 ip link set e1-1-c1-1 up
sudo ip netns exec srsim11 ip link set e1-1-c1-1 mtu 9000
sudo ip netns exec srsim11 ip link set e1-1-c1-1 up

sudo ip link add veth0 type veth peer name veth1
sudo ip link set veth0 netns srsim10
sudo ip link set veth1 netns srsim11
sudo ip netns exec srsim10 ip link set veth0 name e1-1-c1-2
sudo ip netns exec srsim11 ip link set veth1 name e1-1-c1-2
sudo ip netns exec srsim10 ip link set e1-1-c1-2 mtu 9000
sudo ip netns exec srsim10 ip link set e1-1-c1-2 up
sudo ip netns exec srsim11 ip link set e1-1-c1-2 mtu 9000
sudo ip netns exec srsim11 ip link set e1-1-c1-2 up
```

**Comment by sacckth** [comment]
A workaround in the meantime is to create a bridge and add mirror configuration to the box:
In order to capture traffic bidirectionally on a Nokia SR-SIM  the best way is to create a [mirror](https://documentation.nokia.com/sr/25-7/7750-sr/books/oam-diagnostics/mirror-services.html) using the SR OS CLI. A simple example topology using [bridges in container namespace](https://containerlab.dev/manual/kinds/bridge/#bridges-in-container-namespace) and mirror configuration is provided below for convenience.

## Clab topology with mirror
```yaml
name: "sros"
mgmt:
  network: srsim_mgmt
  ipv4-subnet: 10.78.140.0/24
topology:
  kinds:
    nokia_srsim:
      license: /opt/nokia/sros/license-sros25.txt
      image: nokia_srsim:25.7.R1
  nodes:
    sr-sim10:
      kind: nokia_srsim
      type: SR-1 # Implicit default
    sr-sim11:
      kind: nokia_srsim
    # In-namespace bridges for mirroring:
    mirror|sr-sim10:
      kind: bridge
      network-mode: container:sr-sim10
    mirror|sr-sim11:
      kind: bridge
      network-mode: container:sr-sim11
  links:
    # Data Interfaces
    - endpoints: ["sr-sim10:1/1/c1/1", "sr-sim11:1/1/c1/1"]
    - endpoints: ["sr-sim10:1/1/c1/2", "sr-sim11:1/1/c1/2"]
    # Mirror port mapped to in-namespace bridge:
    - endpoints: ["sr-sim10:1/1/c1/3", "mirror|sr-sim10:mirror0"]
    - endpoints: ["sr-sim11:1/1/c1/3", "mirror|sr-sim11:mirror0"]

```
## SR OS Mirror configuration
```
/configure port 1/1/c1/3 admin-state enable
/configure port 1/1/c1/3 ethernet mode hybrid
/configure mirror mirror-dest "mirror0" admin-state enable
/configure mirror mirror-dest "mirror0" service-id 999
/configure mirror mirror-dest "mirror0" { sap 1/1/c1/3:0 }
/configure mirror mirror-source "mirror0" admin-state enable
/configure mirror mirror-source "mirror0" port 1/1/c1/1 ingress true
/configure mirror mirror-source "mirror0" port 1/1/c1/1 egress true
/configure mirror mirror-source "mirror0" port 1/1/c1/2 ingress true
/configure mirror mirror-source "mirror0" port 1/1/c1/2 egress true
```

## tcpdump example
```bash
$ sudo ip netns exec  clab-sros-sr-sim10  tcpdump -nnei mirror0 icmp
tcpdump: verbose output suppressed, use -v[v]... for full protocol decode
listening on mirror0, link-type EN10MB (Ethernet), snapshot length 262144 bytes

10:00:40.281090 aa:c1:ab:0b:55:94 > aa:c1:ab:d7:6e:ae, ethertype IPv4 (0x0800), length 98: 10.0.0.10 > 10.0.0.11: ICMP echo request, id 251, seq 16385, length 64
10:00:40.282415 aa:c1:ab:d7:6e:ae > aa:c1:ab:0b:55:94, ethertype IPv4 (0x0800), length 98: 10.0.0.11 > 10.0.0.10: ICMP echo reply, id 251, seq 16385, length 64
```

**Comment by vista-** [comment]
Starting with Containerlab 0.78, a workaround has been put in place to enable bidirectional packet captures and netem-based link impairment simulation by using `veth-stitch` interfaces instead of regular `veth` for SR-SIM.

The workaround is automatically applied to SR-SIM container links by Containerlab, there is no need to modify your topology or enable any knobs.
